<?xml version="1.0"?>
<!DOCTYPE tileset SYSTEM "tileset.dtd">
<tileset>
	<tile topcodeID="47">
		<name>Serial</name>
		<connections L="1" R="3" />
	</tile>	
	<tile topcodeID="55">
		<name>Internet (Processing)</name>
		<connections L="1" R="5" />
	</tile>	
	<tile topcodeID="61">
		<name>Internet (Shield)</name>
		<connections R="5" T="2" B="2" />
	</tile>	
	<tile topcodeID="79">
		<name>Wifi</name>
		<connections R="5" T="2" B="2" />
	</tile>	
	<tile topcodeID="93">
		<name>Ethernet</name>
		<connections R="5" T="2" B="2" />
	</tile>	
	<tile topcodeID="121">
		<name>Arduino</name>
		<connections R="3" B="2" />
	</tile>	
	<tile topcodeID="167">
		<name>X-Bee Shield</name>
		<connections L="3" R="4" T="2" B="2"/>
	</tile>	
	<tile topcodeID="185">
		<name>X-Bee Explorer</name>
		<connections L="3" R="4" />
	</tile>	
	<tile topcodeID="213">
		<name>X-Bee Breakout</name>
		<connections L="3" R="4" />
	</tile>	
	<tile topcodeID="339">
		<name>Processing</name>
		<connections L="1" R="1" T="1" B="1" />
	</tile>	
</tileset>